<?xml version="1.0" encoding="UTF-8"?>
<listaclientes xmlns:xsi="http://www.w3.org/2001/XMLSchema-instance"
    xsi:noNamespaceSchemaLocation="clientes.xsd">

    <cliente español="si">
        <nombre>Juan</nombre>
        <apellido>Sanchez</apellido>
        <dni>33158697A</dni>
        <compras>4800</compras>
        <regalo>bolsa deporte</regalo>
    </cliente>

    <cliente español="no">
        <nombre>Jose</nombre>
        <apellido>Diaz</apellido>
        <nie>67388382T</nie>
        <compras>4500</compras>
    </cliente>

</listaclientes>